{
  "schemaVersion": "1.0.0",
  "updatedAt": "2026-10-31",
  "skills": [
    {
      "name": "frontend-design",
      "bundled": true,
      "summary": "Dirección estética intencional, tipografía y composición para crear o rediseñar interfaces web.",
      "repository": "https://github.com/davila7/claude-code-templates",
      "sourcePath": "cli-tool/components/skills/creative-design/frontend-design",
      "installedPath": "skills/frontend-design",
      "revision": "7faa175714982142b40bceb2b5de881e3c93a778",
      "license": "Apache-2.0",
      "files": [
        {
          "path": "LICENSE.txt",
          "sha256": "0d542e0c8804e39aa7f37eb00da5a762149dc682d7829451287e11b938e94594"
        },
        {
          "path": "SKILL.md",
          "sha256": "d91970639e9f5c37682ac7ab60094d35f1c7c1f38d731bd56396563aee10c1d3"
        }
      ],
      "matching": {
        "anySignals": [
          "react",
          "nextjs",
          "tailwindcss",
          "astro",
          "vue",
          "svelte"
        ],
        "profiles": [
          "frontend"
        ],
        "taskClasses": [
          "ui-authoring"
        ]
      },
      "overlapsWith": [
        "web-design-guidelines"
      ],
      "review": {
        "status": "reviewed",
        "reviewedAt": "2026-10-28",
        "notes": "Instrucciones Markdown sin scripts ejecutables; se complementa con web-design-guidelines para auditoría posterior.",
        "capabilities": {
          "filesystem": "none",
          "processes": "none",
          "network": "none",
          "paidApi": "none"
        }
      },
      "scenarios": []
    },
    {
      "name": "web-design-guidelines",
      "bundled": true,
      "summary": "Auditoría de accesibilidad, UX y cumplimiento de Web Interface Guidelines sobre código de interfaz.",
      "repository": "https://github.com/vercel-labs/agent-skills",
      "sourcePath": "skills/web-design-guidelines",
      "installedPath": "skills/web-design-guidelines",
      "revision": "ba46938889d4e58635362fb8f618e1178ac3ec46",
      "license": "MIT",
      "files": [
        {
          "path": "SKILL.md",
          "sha256": "f4647ca866a3accf763777f83e7682954f0187cd6bea7eea0399796652414e8f"
        }
      ],
      "matching": {
        "anySignals": [
          "react",
          "nextjs",
          "tailwindcss",
          "astro",
          "vue",
          "svelte"
        ],
        "profiles": [
          "frontend"
        ],
        "taskClasses": [
          "ui-review"
        ]
      },
      "overlapsWith": [
        "frontend-design"
      ],
      "review": {
        "status": "reviewed-with-observations",
        "reviewedAt": "2026-10-28",
        "notes": "Sus instrucciones piden consultar por internet las reglas vigentes de Vercel antes de revisar; ese recurso externo puede cambiar.",
        "capabilities": {
          "filesystem": "read-only",
          "processes": "none",
          "network": "optional",
          "paidApi": "none"
        }
      },
      "scenarios": []
    },
    {
      "name": "mcp-builder",
      "bundled": true,
      "summary": "Diseño e implementación de servidores MCP en Node/TypeScript o Python con herramientas acotadas y esquemas claros.",
      "repository": "https://github.com/anthropics/skills",
      "sourcePath": "skills/mcp-builder",
      "installedPath": "skills/mcp-builder",
      "revision": "b9e19e6f44773509fbdd7001d77ff41a49a486c1",
      "license": "Apache-2.0",
      "files": [
        {
          "path": "LICENSE.txt",
          "sha256": "bc6b3af2f331cbc7fb0da1344efb2cbe5877a31498b4d70dbc7000f3405a1362"
        },
        {
          "path": "SKILL.md",
          "sha256": "0f4592dcb53cf2b5d6b7febee6b4152018b565551a1c29e3c612f57b218ab295"
        },
        {
          "path": "reference/evaluation.md",
          "sha256": "8c99479f8a2d22a636c38e274537aac3610879e26f34e0709825077c4576f427"
        },
        {
          "path": "reference/mcp_best_practices.md",
          "sha256": "80fb4369a349447cf18ecdd7494fe7938b6065377e9f08c077cec411093a3007"
        },
        {
          "path": "reference/node_mcp_server.md",
          "sha256": "c3ba35a4f599dd53be9c6555ae72c19a7bf412cd5426576c2c08d42755482c66"
        },
        {
          "path": "reference/python_mcp_server.md",
          "sha256": "2da52f77e675191014ca2e146a4b95aa04d0ca7dd7e2b100322df15ade685e80"
        },
        {
          "path": "scripts/connections.py",
          "sha256": "9403668a2041568772082a8b334122c1f88daf0541fb393af4522d0094a47a6e"
        },
        {
          "path": "scripts/evaluation.py",
          "sha256": "49ed1d17cdce5da101b210197740713f49b935c29d4f339542a14b132658e6f7"
        },
        {
          "path": "scripts/example_evaluation.xml",
          "sha256": "9272b348ddcc4b06ba562367ccd0770e018158c0068ac5116d5e34aaeff8777a"
        },
        {
          "path": "scripts/requirements.txt",
          "sha256": "d5d7558b2368ecea9dfeed7d1fbc71ee9e0750bebd1282faa527d528a344c3c7"
        }
      ],
      "matching": {
        "anySignals": [
          "mcp-sdk"
        ],
        "profiles": [
          "mcp",
          "backend"
        ],
        "taskClasses": [
          "mcp-development"
        ]
      },
      "overlapsWith": [],
      "review": {
        "status": "reviewed-with-observations",
        "reviewedAt": "2026-10-28",
        "notes": "Incluye ejemplos Node SDK v1 y un evaluador Python opcional con llamadas de pago a la API de Anthropic sin tope automático.",
        "capabilities": {
          "filesystem": "read-only",
          "processes": "optional",
          "network": "optional",
          "paidApi": "optional"
        }
      },
      "scenarios": []
    },
    {
      "name": "differential-review",
      "bundled": true,
      "summary": "Revisión diferencial de seguridad en commits/PRs con radio de impacto, historial git y cobertura de pruebas.",
      "repository": "https://github.com/trailofbits/skills",
      "sourcePath": "plugins/differential-review/skills/differential-review",
      "installedPath": "skills/differential-review",
      "revision": "123037ec8aed26f0d86327cc39137ee5043e5deb",
      "license": "CC-BY-SA-4.0",
      "files": [
        {
          "path": "LICENSE.txt",
          "sha256": "7abe19ec9bb73b36141b999b861d24ad855e808bafe0f81e84cce28556f6c297"
        },
        {
          "path": "SKILL.md",
          "sha256": "f9af6a8193fc1a9f8ca3c54bb8d19095a5f20c9472ca6d014488bbde50b67da0"
        },
        {
          "path": "adversarial.md",
          "sha256": "3cb823f38c6e551cbcf5f72325d2bb219dacdad774072519c31d50d92db19800"
        },
        {
          "path": "agents/openai.yaml",
          "sha256": "0279d56f88dc1a04d4b1941a25fa7672912a3ceb0557b13c38d069908b30ae61"
        },
        {
          "path": "assets/trail-of-bits-mark.svg",
          "sha256": "4bf74c789b38dcf6ad762c136b6832363d27ae19fbaa9a18ec18d66ecce6ca05"
        },
        {
          "path": "methodology.md",
          "sha256": "16b335d24cf2145e3dc4a37f50056550d29db2efa20e6df78fec95ec1e6fb0b4"
        },
        {
          "path": "patterns.md",
          "sha256": "52abb18abbc73502a3d3b2f36a7a035adc1db40fd812d1d5424cf065036a06e9"
        },
        {
          "path": "reporting.md",
          "sha256": "0016876dc6f158e926448bff1b6f634796757c7afe09dff177cfe30250724fc4"
        }
      ],
      "matching": {
        "anySignals": [],
        "profiles": [
          "security"
        ],
        "taskClasses": [
          "security-diff-review"
        ]
      },
      "overlapsWith": [
        "quality-gate"
      ],
      "review": {
        "status": "reviewed-with-observations",
        "reviewedAt": "2026-10-28",
        "notes": "Licencia CC BY-SA 4.0 conservada; menciona agentes auxiliares del plugin de Trail of Bits no distribuidos aquí.",
        "capabilities": {
          "filesystem": "read-only",
          "processes": "optional",
          "network": "none",
          "paidApi": "none"
        }
      },
      "scenarios": []
    },
    {
      "name": "vercel-react-best-practices",
      "bundled": true,
      "summary": "Reglas de rendimiento, carga asíncrona, bundles y renderizado para React y Next.js mantenidas por Vercel.",
      "repository": "https://github.com/vercel-labs/agent-skills",
      "sourcePath": "skills/react-best-practices",
      "installedPath": "catalogs/skills/vercel-react-best-practices",
      "revision": "1a2c79d4e6c4a2283dc2c614b6538cbe1ed5ca62",
      "license": "MIT",
      "files": [
        {
          "path": "AGENTS.md",
          "sha256": "fc93e7421177bbf869cce892bc60a6c83a4517d974bc3bf65c4e2c1e58a6ccf6"
        },
        {
          "path": "README.md",
          "sha256": "9eafb2123d3b8b2aef41fba0db2648a3f4f49996f8c7c8bb2c86263befd8b48a"
        },
        {
          "path": "SKILL.md",
          "sha256": "71ed7794962fa6e803ee83030517b5b93a9f70fbfeb431ec4535c5480a8d8355"
        },
        {
          "path": "metadata.json",
          "sha256": "c4e18bac3290fbe1b471a605867d4df68b03144ea26b8befdbe8f9d8fd124354"
        },
        {
          "path": "rules/_sections.md",
          "sha256": "01c59969e4e867f0708c8f8ef9c6d87fab9a07d0586244f429ff84013db8a115"
        },
        {
          "path": "rules/_template.md",
          "sha256": "99df2a3ea088c6c22de2484ddc7e964d0e9923846f44c63380343ecc64455442"
        },
        {
          "path": "rules/advanced-effect-event-deps.md",
          "sha256": "55ed8f9f27a1bff803d6fa55828176207714b02123cbb97ddb8a90d88024a723"
        },
        {
          "path": "rules/advanced-event-handler-refs.md",
          "sha256": "a3097edeecfb2ff6851cd66ed8cdf0617c3c88180504bee824aa6e75a215bbbc"
        },
        {
          "path": "rules/advanced-init-once.md",
          "sha256": "3e4dc22173eb0e2b6dcf583e3babd862b8696328f8f59aee7c4d746c5bc05f6c"
        },
        {
          "path": "rules/advanced-use-latest.md",